State,City,Hospital / Private,Category,Systems of Medicine,Contact Details,Area Pin Code,Email address,Website link,Specializations,Services
Maharashtra,Pune,Sai Sneh Hospital,Private,Allopathic,"Pune-Satara highway, Opposite PMT Bus depot, Katraj, Pune, Maharashtra, Phone- (020) 26959208",411046,saisneh@gmail.com,http://www.saisneh.com,"Anesthesiology,  Cardiology,  Chest Physician,  Dentistry,  Dermatology,  Dietetics,  Endoscopy,  ENT,  Gastroenterology,  General Medicine,  General Surgery,  Gynaecology ,  Laparoscopic Surgery,  Maxillofacial Surgery,  Nephrology,  Neuro Surgery,  Neurology  Ophthalmology  Orthopedic Surgery,  Pathology,  Pediatrics,  Physiotherapy,  Plastic Surgery,  Psychiatry,  Psychology,  Sonology,  Surgical Oncology,  Urology","4 hour trauma & accident centre, 24 hour Ambulance, Well equipped ICU Well equipped Operation Theaters, 25 bedded indoor facility"
Maharashtra,Pune,Vora Multispeciality Dental Clinic And Implant Centre,Private,Allopathic,"Flat No 5 567/4a Shivam Apartment Vastu Nagar Society, Bibvewadi Kondhwa Road, Bibvewadi, Pune, Maharashtra, Phone- (020) 66829185",411037,NA,NA,Dentistry,NA
Maharashtra,Pune,Niramaya Hospital,Private,Allopathic,"Survey No. 4742, Behind Jai Hind Petrol Pump, Next to Chinchwad (E) Post Office, Chinchwad , Pune, Maharashtra, Phone- (020) 27441860, 27441864, 27607777",411019,niramayachinchwad@niramayahospital.com,http://www.niramayahospital.com,"Accident & Emergency,  Anesthesiology,  Cardiology,  Chest Physician,  Dentistry,  Dermatology,  Diabetology,  Endocrinology,  ENT,  Gastroenterology,  General Medicine,  General Surgery,  Joint Replacement Surgery,  Medical Oncology,  Nephrology,  Neuro Surgery,  Neurology,  Obstetricsand Gynaecology,  Ophthalmology,  Orthopedics,  Pathology,  Pediatrics,  Physiotherapy,  Plastic Surgery,  Psychiatry,  Radiology,  Surgical Oncology,  Urology",NA
Maharashtra,Pune,B.J. Medical College and Sassoon Hospital,Private,Allopathic,"Near Pune Railway Station, Pune, Maharashtra, Phone- (020) 26128000",411001,NA,http://www.bjmcpune.org,"Anesthesiology,  Bio-Chemistry,  Cardiology,  Cardiothoracic Surgery,  Cardiovascular Surgery,  General Medicine,  General Surgery,  Micro-Biology,  Nephrology,  Neuro Surgery,  Obstetrics and Gynaecology,  Ophthalmology,  Orthopedics,  Otolaryngology,  Pathology,  Pediatric Surgery,  Pediatrics,  Physiotherapy,  Plastic Surgery,  Psychiatry,  Radiology,  UroSurgery",NA
Maharashtra,Pune,Sai Shree Hospital,Private,Allopathic,"251/252, Opposite Telephone Exchange, Near Parihar Chowk, Aundh, Pune, Maharashtra, Phone- (020) 41088600, Emergency: (020) 41088600",411007,NA,http://www.saishreehospital.org,"Anesthesiology,  Cardiology,  ENT,  General Surgery,  Neuro Surgery,  Orthopedics,  Pathology,  Radiology,  Vascular Surgery","ICU, Bone mineral, densitometry, EEG, EMG and NCV investigations, Foot scan for early diagnosis of diabetic complications, Stretcher Lift24 hours Ambulance serviceIn house Medical StorePathology LAB X - Ray"
Maharashtra,Pune,Chavan hospital,Private,Allopathic,"54, Stadium Road, Vastu Udyog - Ajmera Corner, Pimpri, Pune,Maharashtra,Phone-(020) 66301236 / 7, Fax -(020) 66301239",411018,chavanhospital@hotmail.com,http://chavanhospital.com/,NA,"Surgical Intensive Care Unit, Well equipped Operation Theater with 'C' Arm facility ,Advanced treatment for Fractures &Orthopedic Surgery, Arthroscopic Joint Surgery, Laparoscopic Abdominal Surgery,Plastic Surgery, Urology, Neuro-SurgeryMedicine Intensive Care Unit ,Consultants with all major sub-specialties, Normal Delivery & Other Gynaecology OperationsX-Ray facilities onsite, E.C.G., Ambulance Facility, 24 Hours Medical Store, Special Rooms,"
Maharashtra,Thane,Bhaktivedanta Hospital,Private,"Allopathic, Ayush/ Ayurveda/ Homeopathy","Shrishti Complex, Bhaktivedanta Swami Marg, Mira Road (East), Thane, Maharashtra, Phone- (022) 29452500",401107,NA,http://www.bhaktivedantahospital.com,"Acupuncture,  Anesthesiology,  Audiology and Speech Therapy,  Ayurveda,  Cardiology,  Chest Physician,  Dentistry,  Dermatology , Dietetics ,  Endocrinology,  ENT,  Gastroenterology,  General Surgery  Gyneac Oncology,  haematology  Homeopathy  Joint Replacement Surgery,  Maxillofacial Surgery  Nephrology,  Neuro Surgery,  Neurology  Ophthalmology,  Orthodontics,  Orthopedics  Pain Management,  Palliative Care,  Pediatric , Nephrology,  Pediatric Neuro Surgery,  Pediatric Orthopedics ,  Pediatric Surgery,  Pediatrics Physiology Physiotherapy Plastic Surgery Psychiatry Psychology Radiology Sonology Spine Surgery Sports Medicine Surgical Oncology Urology Vascular Surgery","ICU Wards, Pharmacy, NICU, EEGSonology, PFT"
